common_voice_en_586902.wav,please add this artist to todo novedadelawares
common_voice_en_18722359.wav,the fields contain either bituminous coal or semi anthracite and all occur within pennsylvanian strata
common_voice_en_18722379.wav,many of these are of yiddish or jewish origin
common_voice_en_18785172.wav,the interchange at main reef road was removed
common_voice_en_18785247.wav,firstly the town was called rykiv and only latter it was renamed to kosiv
common_voice_en_18785404.wav,radmanovich is a graduate of pepperdine university
common_voice_en_18785423.wav,the newspaper has never missed an issue since
common_voice_en_18785432.wav,it typically has several main stems
common_voice_en_18785463.wav,the unincorporated communities of brodtville and wyalusing are located in the town
common_voice_en_18785473.wav,he also came on the following week against bolton wanderers
common_voice_en_18668209.wav,the back of a book has a blurb section
common_voice_en_18670463.wav,they moved frequently from one cheap flat to another
common_voice_en_18550036.wav,would you like to customize your device
common_voice_en_18577856.wav,‘one indeed!’ said the dormouse indignantly
common_voice_en_573865.wav,a man is sitting in a chair at a table surrounded by a bunch of people
common_voice_en_18697890.wav,her commentary has also appeared on the guardiancouk website
common_voice_en_18698093.wav,key: p–games played w–games won d–games drawn; l–games lost %–win percentage
common_voice_en_18767501.wavm,the chief historian is prof dina porat
common_voice_en_18709170.wav,undergraduate and graduate admission to colmex is very selective
common_voice_en_18712136.wav,the area immediately south and west of st lambert was covered with german dead
common_voice_en_18712375.wav,hu is now a san francisco based venture capitalist with walden international investment group
common_voice_en_18717937.wav,the figure of kathleen ni houlihan has also been invoked in nationalist irish politics

