common_voice_en_515353.wav, why didn't you ask neal about it
common_voice_en_18831079.wav, this gives employees increased certainty
common_voice_en_532457.wav, martin luther king jr was an an american civil rights leader
common_voice_en_17581077.wav,if you still don't know what recursion is read this sentence again
common_voice_en_493752.wav,no i asked pamela and mark for directions before i left
common_voice_en_60861.wav,there are no words to describe how difficult that day was
common_voice_en_60860.wav,do male kangaroos have a pouch
common_voice_en_18829045.wav,all were portraits
common_voice_en_454955.wav,he wrote down a long list of items
common_voice_en_18830344.wav,in the following chapter he creates a template for descriptions of his macabre subject
common_voice_en_7538725.wav,a friend of yours
common_voice_en_151826.wav,his father said no more
common_voice_en_17265492.wav,he who laughs last laughs longest
common_voice_en_17265491.wav,potatoes are less spacesaving durable and cheap than pasta
common_voice_en_124225.wav,and yet none of these people has ever met the old king
common_voice_en_58976.wav,there's life here the boy said to the alchemist
common_voice_en_17269127.wav,quiet down will you
common_voice_en_220910.wav,there was no response from the elders
common_voice_en_18576998.wav,the company utilizes a just in time manufacturing process
common_voice_en_529566.wav,she'll see us through dinner
common_voice_en_557089.wav,it brought his heart into his mouth
common_voice_en_588209.wav,but the boy was quiet
common_voice_en_16047860.wav,the team with the best timing looks good
common_voice_en_654333.wav,diligence is the mother of good luck
common_voice_en_8580.wav,it sort of makes a fellow lose faith in himself
common_voice_en_8582.wav,it infuriates me and i don't know why
common_voice_en_18754521.wav,it was built on land formerly held by the macfadzeans
common_voice_en_18754523.wav,the rural population saw the old religious order in danger
common_voice_en_67613.wav,he's allergic to him
common_voice_en_67617.wav,they opened the bottle of wine and drank heavily
common_voice_en_23533.wav,love required them to stay with the people they loved
common_voice_en_62618.wav,give me the list of films at santikos theatres
common_voice_en_18009119.wav,i'm sure carley is not a coward
common_voice_en_17728545.wav,it's raining heavily take an umbrella
common_voice_en_34501.wav,cry havoc and let slip the dogs of war
common_voice_en_335848.wav,i have always wanted to travel the world
common_voice_en_17897360.wav,the book has been wrong in the past
common_voice_en_18556.wav,he sat looking at the sky for a long time
common_voice_en_137640.wav,that's the way it will be with our love for each other
common_voice_en_185033.wav,two smiling boys are sitting beside a fruit cart
common_voice_en_16185483.wav,my friend murad is coming in this weekend
common_voice_en_552653.wav,i can clean up those glasses in the window if you want said the boy
common_voice_en_17776051.wav,not in a month of sundays
common_voice_en_214077.wav,the tradition teaches men how to cross the desert and how their children should marry
common_voice_en_474108.wav,darling could you grab me some throat candy down at the local chemist
common_voice_en_9684911.wav,but i knew better
common_voice_en_646464.wav,but you want to know something
common_voice_en_18851539.wav,when sober he hates chandramukhi and loathes her presence
common_voice_en_629083.wav,they were tribesmen dressed in blue with black rings surrounding their turbans
common_voice_en_420361.wav,mister robinson will be on time
common_voice_en_420359.wav,two caribous in a queue they didn't have a clue that i was using their flue to write a poem for you
common_voice_en_586811.wav,she must hate me why wouldn't she
common_voice_en_17271034.wav,madam this is the best brand of corn
common_voice_en_18064213.wav,raccoons are mammals as well
common_voice_en_458734.wav,the loss of the second ship was hard to take
common_voice_en_577487.wav,the snake fought frantically making hissing sounds that shattered the silence of the desert
common_voice_en_18886270.wav,the results of the principal competitions are shown below
common_voice_en_18886304.wav,below is a list of the games published by techland publishing
common_voice_en_18886575.wav,anderson mill is named after thomas anderson
common_voice_en_18886577.wav,beloit memorial high school is the city's public high school
common_voice_en_97340.wav,there is a whole lot of joy in playing piano
common_voice_en_18849739.wav,these ideas reduce the authority value integrity and independence of science in society
common_voice_en_18849936.wav,in addition he also made some of the cover of the albums
common_voice_en_18849944.wav,he produced dude i'm moving out
common_voice_en_18849882.wav,hoctor departed after four months leaving edwards as solo host for the next quarter century
common_voice_en_18849866.wav,botesdale is served by simonds of botesdale limited's country link bus service
common_voice_en_18849842.wav,the year after fred varley made the same journey to work for grip
common_voice_en_18803350.wav,the word kinnickinnic is ojibwe in origin
common_voice_en_190097.wav,a ballerina dressed in yellow is dancing on a stage
common_voice_en_18855664.wav,the rules include make noise touch anything get dirty and have fun
common_voice_en_18855802.wav,photographs of lupus would appear in a number of issues
common_voice_en_18855723.wav,shelagh rogers and stuart mclean were frequent guest hosts in later years
common_voice_en_18855678.wav,he currently resides in jupiter florida
common_voice_en_18855725.wav,their movements coincided with a similar trend of populism in europe
common_voice_en_18855722.wav,browne was the son of robert browne of falkirk scotland
common_voice_en_18855803.wav,team member cody mattern
common_voice_en_18549252.wav,fewer people are subscribing to our channel
common_voice_en_18549173.wav,the lower windows i could not see
common_voice_en_18549194.wav,i’ve simply got to go
common_voice_en_18549251.wav,it was an overwhelming deluge of rain
common_voice_en_18549253.wav,this is a serious matter for both of you
common_voice_en_18549255.wav,i don't mind telling you
common_voice_en_18549158.wav,there's nobody in the house
common_voice_en_18549171.wav,your hard work is appreciated
common_voice_en_18549175.wav,‘sap and sawdust’ said the gnat
common_voice_en_18549261.wav,oh that very bad child!
common_voice_en_18879035.wav,he described himself as an organizer and finished fourth on both occasions
common_voice_en_18738671.wav,he suffered from bleeding and had to undergo stomach removal to save his life
common_voice_en_18738923.wav,they are currently used by the b and c branches respectively
common_voice_en_127612.wav,people are shopping at an asian market
common_voice_en_127620.wav,an elderly couple sit next to each other at a coffee shop
common_voice_en_18605429.wav,what did the torn up scrap of writing mean
common_voice_en_18605442.wav,we are taught the periodic table in high school
common_voice_en_18914771.wav,the gorge then broadens past dana and tatopani toward beni
common_voice_en_44121.wav,man and child riding in gocart
common_voice_en_217026.wav,a man performs tricks on a dirt ramp on a green bike
common_voice_en_18723966.wav,the lyrics are by maurice albert thiriet
common_voice_en_18748353.wav,metastasio lived with bulgarelli and her husband in rome
common_voice_en_191580.wav,looking for the saga called the scofflaw
common_voice_en_18781946.wav,ned and laura marry a few days later
common_voice_en_18539227.wav,it's embarrassing to admit but that's me in the picture
common_voice_en_18319978.wav,i have been robbed sir i amended
common_voice_en_216009.wav,shirtless man skateboards down a sunny roadside
common_voice_en_18836697.wav,shadows' vocal style has evolved significantly over the years
common_voice_en_539045.wav,a group of asian young adults are gathered in a classroom setting
common_voice_en_539041.wav,a young pigtailed girl is swinging her bat at a ball on a post
common_voice_en_18734590.wav,the theater maintains the military patriotic tendency and realistic style
common_voice_en_18851656.wav,there are two possible origins for the name of the city
common_voice_en_18655445.wav,‘open the bag!’ he whispered
common_voice_en_18715597.wav,the mitochondria have tubular cristae
common_voice_en_18715627.wav,the movement is part of a broader māori renaissance
common_voice_en_18793891.wav,the town of petrovaradin is the seat of petrovaradin municipality
common_voice_en_188431.wav,add this c j chenier album to my this is no te va gustar playlist
common_voice_en_18733404.wav,the unincorporated community of fisher is near the center of the township
common_voice_en_543589.wav,a male standing in the mountains holding a gun
common_voice_en_18429751.wav,i'm writing my essay on municipal internet
common_voice_en_208062.wav,a chef is preparing a meal in a professional kitchen
common_voice_en_18862540.wav,his father taught him to play the violin
common_voice_en_18717230.wav,lyrics and screenplay were written by howard schuman
common_voice_en_18708638.wav,advertising is shared with its sister title the northumberland gazette
common_voice_en_18831746.wav,halabi and his followers supported mohammad mosaddegh
common_voice_en_18831828.wav,mykhailo verbytsky was born in the nadsyannya
common_voice_en_18733690.wav,at that time the committee consisted of just twenty two universities and university colleges
common_voice_en_18714763.wav,note that name origin and terminus of some lines are changed with numbering scheme
common_voice_en_18566871.wav,she ran to the cloak room and came back again with her cloak
common_voice_en_18902272.wav,analytical methods are available to determine phytoestrogen content in plants and food
common_voice_en_18841350.wav,it is also the location of an archaeological site
common_voice_en_18841412.wav,it handles large image data sets
common_voice_en_18878202.wav,bankislami pakistan limited made a public offering of rs
common_voice_en_18733546.wav,jerseyville is located nearby
common_voice_en_45973.wav,please find me the platinum box ii song
common_voice_en_18344307.wav,i exported the model in json format
common_voice_en_18783359.wav,he was cast as the eldest sibling chuck cunningham on happy days
common_voice_en_18783396.wav,iris is somewhat slower than her father because of her young age
common_voice_en_18783399.wav,he grew up in tondo manila
common_voice_en_18783480.wav,the radio edit is eight seconds shorter than the album version
common_voice_en_18733140.wav,he was an accomplished zoologist and paleontologist as well as an ordained presbyterian minister
common_voice_en_18730017.wav,more than most heruy saw similarities between japan and ethiopia
common_voice_en_18875781.wav,three points is the equivalent of a goal
common_voice_en_18875785.wav,one views x as suspended between the end points
common_voice_en_18875800.wav,thus bhutan doesn't have an independence day because it was never under anyone's rule
common_voice_en_18875798.wav,all songs written by saul williams except where noted
common_voice_en_18875808.wav,these characteristics make it ideal for feeding to infants and the elderly
common_voice_en_18849792.wav,reggie and sam then go shopping at a mall
common_voice_en_18849868.wav,hooper since has not been active in the motion picture industry
common_voice_en_18849909.wav,his songs can often be heard on popular radio stations across yorubaland
common_voice_en_18849829.wav,it is the third largest county in minnesota by land area
common_voice_en_18849849.wav,when this is passed through the same smoothing system the output is zero
common_voice_en_18849911.wav,joseph w luter sr's first job was at a local meat packing plant
common_voice_en_18849927.wav,eight warships of the royal navy have also been named after him
common_voice_en_18849800.wav,brookfield's renewable power assets include hydroelectric power plants and wind power assets
common_voice_en_18849924.wav,he has degrees in journalism and mathematics from universities in grenoble and paris
common_voice_en_18849968.wav,so the meaning is probably 'oak tree hamlet'
common_voice_en_18849987.wav,along the north east side is the connected but walled off plymouth jewish cemetery
common_voice_en_18882522.wav,iranian officials blamed the country's poor aviation record on the sanctions
common_voice_en_491247.wav,add the tune to my women of latin music playlist
common_voice_en_18727566.wav,originally may week took place in the week during may before year end exams began
common_voice_en_18728934.wav,praemunire in classical latin means to fortify
common_voice_en_18832707.wav,his management style made him unpopular with lab scientists
common_voice_en_18623766.wav,lastly it was no one and i was no one
common_voice_en_18679059.wav,in germany he reorganized the shevchenko scientific society as an émigré institution
common_voice_en_18890474.wav,in the first anime adaptation zoisite is kunzite's lover
common_voice_en_18771663.wav,he represented the republic of ireland at international level
common_voice_en_18771681.wav,a prominent song was  zindagi hai pyar se pyar se bitaye ja
common_voice_en_18771668.wav,lindemann commanded the corps during the advance towards leningrad
common_voice_en_18718128.wav,ross was born in arecibo puerto rico
common_voice_en_18840602.wav,janney has remained active in theater
common_voice_en_18657917.wav,but i longed so much to see you my dear mr george
common_voice_en_18734088.wav,instant feedback is received via web or mobile
common_voice_en_18528900.wav,a machine learning model will need to be retrained to avoid decay
common_voice_en_543264.wav,book me a reservation for twenty two faraway from our place
common_voice_en_543275.wav,find me the tv show we lived for estonia
common_voice_en_18586668.wav,i was not prepared for it
common_voice_en_18593567.wav,in the end they triumphed over the other team
common_voice_en_18758153.wav,ibn masawayh apparently attracted considerable audiences having acquired a reputation for repartee
common_voice_en_18755258.wav,the standards and upkeep of rest areas facilities vary
common_voice_en_599234.wav,two men walking past a mural of a car
common_voice_en_18723315.wav,you can call or put in american bermudan or european exercise style
common_voice_en_18723313.wav,balonne shire council operates a library in william street
common_voice_en_18723394.wav,a war cemetery exists in their memory
common_voice_en_18723410.wav,his poetry is beautiful and expresses the deep things of the spirit
common_voice_en_18723401.wav,god was there every single time every single time
common_voice_en_18723407.wav,the fourth big dish is either sweet vegetables or soup
common_voice_en_18723572.wav,his reputation was building fast and he started selling out shows in smaller venues
common_voice_en_18723780.wav,mcmillan was defeated by democrat lane evans in november
common_voice_en_43484.wav,people outside in a field harvesting something
common_voice_en_43494.wav,a man and woman are birdwatching
common_voice_en_18709243.wav,skarsgård designated stormare the godfather to his son gustaf
common_voice_en_18799129.wav,after ishidate petrifies shadabada naruto uses the crescent moon rasengan to defeat ishidate
common_voice_en_18732434.wav,russian diplomats spent significant funds on diplomacy and propaganda
common_voice_en_18753044.wav,the north western part is called bull point but is normally included in the area
common_voice_en_18753102.wav,the italian terraces with their sculptures survive from the destroyed crystal palace
common_voice_en_582711.wav,a woman proudly shows off a decorative lamp
common_voice_en_18650196.wav,this otorhinolaryngologist treated my hearing problems
common_voice_en_18553310.wav,what could have divided you
common_voice_en_18553329.wav,'counsel’s office’ replied the executor in a whisper
common_voice_en_18672204.wav,ludwig van beethoven dedicated his ouverture op
common_voice_en_18672353.wav,independent andrzej olechowski came second beating solidarity candidate krzaklewski into third place
common_voice_en_18540052.wav,you're not one of the weak legged ones you ain't
common_voice_en_18540049.wav,the breath was struck out of her body
common_voice_en_18541332.wav,what could i ever do but thank him!
common_voice_en_18541292.wav,as it turns out the wedding is not today
common_voice_en_18541666.wav,that is a quote from a famous parable
common_voice_en_18546631.wav,domestic violence should not be tolerated
common_voice_en_18546652.wav,my guardian asked him what he meant
common_voice_en_18840479.wav,battles are similar to those of the previous grandia games
common_voice_en_18841343.wav,simple programs are capable of a remarkable range of behavior
common_voice_en_18840525.wav,a famous sangharama was that of kukkutarama in pataliputra
common_voice_en_18841395.wav,he graduated from the university of southern california's school of cinema television
common_voice_en_18841427.wav,he was born in stotfield lossiemouth morayshire
common_voice_en_691872.wav,the dog with the red collar is bearing its teeth at the dog with the blue collar
common_voice_en_691885.wav,a man in a red shirt sits at a table with a glass of water
common_voice_en_18850945.wav,it's razzle dazzle of a random sort but it works
common_voice_en_18850848.wav,nine of these light cruisers would be rebuilt as light aircraft carriers
common_voice_en_18851449.wav,it is also known as the yalong bay national resort
common_voice_en_18846655.wav,home published prolifically on human and animal anatomy
common_voice_en_18738974.wav,elkanah settle signed the dedication to the duchess of albemarle
common_voice_en_18708772.wav,the sheet is then dried under pressure
common_voice_en_18708854.wav,this decisive action helped put matters to rest
common_voice_en_18686946.wav,knox is part of regional school unit no
common_voice_en_18605862.wav,he was referred to the hospital
common_voice_en_18605884.wav,would you mind describing him to me
common_voice_en_18605911.wav,it was a breath of relief
common_voice_en_18849785.wav,draper also wrote many articles for the various magazines of his time
common_voice_en_18849932.wav,the subdivision is located near the high school on the northeast side of town
common_voice_en_18850144.wav,cheap metal plates which are the most durable remain common in the developing world
common_voice_en_18849963.wav,the climate is temperate and semi moist with most rain in the summer
common_voice_en_18850150.wav,areas with very little to no vegetation are the primary target
common_voice_en_18850221.wav,good weekend is edited by amelia lester
common_voice_en_18850239.wav,the headquarters was in georgetown
common_voice_en_18850318.wav,this is not always the case however
common_voice_en_18850278.wav,three years later he moved with his family to rome
common_voice_en_18850302.wav,it is in the south west of the country and its capital was fier
common_voice_en_18850427.wav,franklin native kenny perry was the runner up in the event's final sudden death playoff
common_voice_en_18850629.wav,general edward hatch and a brigade under colonel horace capron
common_voice_en_18850551.wav,this class includes also the abbreviations for the names of most sees
common_voice_en_18850616.wav,there are also many old wooden houses in the city
common_voice_en_18850617.wav,they gave him the name n'chaka meaning the man without a tribe
common_voice_en_18850662.wav,the powerfully built centre joined the eastern suburbs club straight out of school
common_voice_en_18850739.wav,the whiteman family established mussel pool as a picnic area for their employees
common_voice_en_18747138.wav,among women incidents of acephalgic migraine increase during perimenopause
common_voice_en_18730174.wav,they are responsible for setting salaries the annual budget and special spending
common_voice_en_18730210.wav,division can be viewed either as quotition or as partition
common_voice_en_18842138.wav,the group disbanded after this single
common_voice_en_18842153.wav,four of the six experimental aircraft were lost to accidents
common_voice_en_18928214.wav,her brother is also a world class swimmer
common_voice_en_18844518.wav,the length of the articles varies
common_voice_en_18844525.wav,aldicarb is a cholinesterase inhibitor which prevents the breakdown of acetylcholine in the synapse
common_voice_en_18641829.wav,academics wish for their work to be recognized and attributed
common_voice_en_18699664.wav,cakile species grow as annual plants with an erect or decumbent stem
common_voice_en_18699752.wav,schaech wrote his first book titled rick dempsey's caught stealing
common_voice_en_18709061.wav,it is unrivaled in its breadth of coverage and its insight
common_voice_en_18563769.wav,misdiagnoses could result in mistreatment
common_voice_en_18818582.wav,the song is a high thin pit seet seet seet seet and the call is a sharp tsip
common_voice_en_18907760.wav,he was diagnosed with hallucinations and paranoia
common_voice_en_18592309.wav,do you dread a particular person
common_voice_en_18592361.wav,to constrain content piracy digital rights management technology was introduced
common_voice_en_18713765.wav,nakatsu's mt
common_voice_en_18844696.wav,giresun has a high and evenly distributed precipitation throughout the year
common_voice_en_545679.wav,a child runs near some trees
common_voice_en_545700.wav,two woman are sitting at a table working with clay
common_voice_en_545775.wav,a light brown dog is playing in front of two spotted cows
common_voice_en_18707156.wav,however emeralds a b cetc
common_voice_en_18732157.wav,gondwanatitan had vertebral lateral fossae that resembled shallow depressions
common_voice_en_18842844.wav,i would like to focus on the things i would do he said
common_voice_en_18724836.wav,goguryeo's third king daemusin attacked dongbuyeo and killed daeso
common_voice_en_18705097.wav,this article illustrates some typical applications of operational amplifiers
common_voice_en_18563102.wav,my knowledge of human nature tells me it will work
common_voice_en_18851980.wav,piranhea is native to south america and to mexico
common_voice_en_18852062.wav,alexandre was born in rouen france
common_voice_en_18714526.wav,other elected officials include clerk treasurer sheriff assessor and prosecutor
common_voice_en_18723172.wav,his work also has implications for substance abuse disorders
common_voice_en_18723785.wav,psychotherapy has focused understandably on pathology
common_voice_en_18845892.wav,sangeetha sabha constructed purandhara bhavan which promotes performing arts theater and drama
common_voice_en_18666633.wav,c sharp is a programming language
common_voice_en_18708924.wav,symmetrical stretches and bends however tend to be raman active
common_voice_en_18706045.wav,the first side read:  while the second side read:
common_voice_en_593072.wav,i want to book a indonesian brasserie far from savoonga on february eleventh
common_voice_en_18725537.wav,slavers was written by sean k reynolds and chris pramas
common_voice_en_18726189.wav,to assist the elderly and disabled many routes have low floor buses
common_voice_en_18726678.wav,he trained at the bristol old vic theatre school
common_voice_en_18726787.wav,the library became a focal point to the burgeoning harlem renaissance
common_voice_en_18727002.wav,his stablemaster onoe oyakata commented all wrestlers have their unique personalities
common_voice_en_18664663.wav,then he wouldn't have got himself into these troubles
common_voice_en_18353767.wav,he deluged me overwhelmed me with argument
common_voice_en_18693512.wav,iolo morganwg adds saint cenydd to the list
common_voice_en_18757082.wav,subspecies bachmani macrorhinus and virgulti are less geographically restricted
common_voice_en_18866759.wav,civil war ensues culminating in peter pevensie defeating miraz in a duel
common_voice_en_18866760.wav,twenty plutonium radioisotopes have been characterized
common_voice_en_18866786.wav,mackinac pipes were specifically engineered to withstand the straits' brutal underwater environment
common_voice_en_18866862.wav,there are still no mainstream female qawwals
common_voice_en_18866902.wav,existentialism feminism and simone de beauvoir
common_voice_en_18777915.wav,this demand was viewed as detrimental by the sunni religious leaders
common_voice_en_18639921.wav,i deiced the car this morning
common_voice_en_18667515.wav,ricardo stared at his friend
common_voice_en_18671610.wav,collusion is evidenced in many ways
common_voice_en_18706777.wav,cruise control power steering and air conditioning were optional
common_voice_en_18707384.wav,service is provided daily from early morning to late evening
common_voice_en_18707382.wav,it is expected that future governors general will serve in this position
common_voice_en_18707428.wav,after a stellar career at joliet junior college mitchell transferred to texas tech
common_voice_en_18707490.wav,herculaneum city park located on south joachim avenue is the largest park in herculaneum
common_voice_en_18707577.wav,there are only three new world phyllostomid bats of comparable size
common_voice_en_18632017.wav,the impact of a drought on a society
common_voice_en_18632268.wav,and now i will ask you a question in return
common_voice_en_18670604.wav,the website is also supported by martin lewis' moneysavingexpertcom website
common_voice_en_18316601.wav,shall we go up in the lift or shall we take the escalator
common_voice_en_18316719.wav,i have no idea replied philip
common_voice_en_18342074.wav,the land exchanged its austere robes for the garb of a smiling wanton
common_voice_en_18670981.wav,karp d r et al
common_voice_en_18561004.wav,he had been guilty of a clumsiness — even he
common_voice_en_18843236.wav,future interim prime minister hugh watt became nordmeyer's deputy leader
common_voice_en_18675627.wav,gopi also worked in tamil film i as dr vasudevan
