common_voice_en_586902.wav,please add this artist to todo novedadelawares
common_voice_en_18722359.wav,the fields contain either bituminous coal or semi anthracite and all occur within pennsylvanian strata
common_voice_en_18722379.wav,many of these are of yiddish or jewish origin
common_voice_en_18785172.wav,the interchange at main reef road was removed
common_voice_en_18785247.wav,firstly the town was called rykiv and only latter it was renamed to kosiv
common_voice_en_18785404.wav,radmanovich is a graduate of pepperdine university
common_voice_en_18785423.wav,the newspaper has never missed an issue since
common_voice_en_18785432.wav,it typically has several main stems
common_voice_en_18785463.wav,the unincorporated communities of brodtville and wyalusing are located in the town
common_voice_en_18785473.wav,he also came on the following week against bolton wanderers
common_voice_en_18668209.wav,the back of a book has a blurb section
common_voice_en_18670463.wav,they moved frequently from one cheap flat to another
common_voice_en_18550036.wav,would you like to customize your device
common_voice_en_18577856.wav,‘one indeed!’ said the dormouse indignantly
common_voice_en_573865.wav,a man is sitting in a chair at a table surrounded by a bunch of people
common_voice_en_18697890.wav,her commentary has also appeared on the guardiancouk website
common_voice_en_18698093.wav,key: p–games played w–games won d–games drawn; l–games lost %–win percentage
common_voice_en_18767501.wavm,the chief historian is prof dina porat
common_voice_en_18709170.wav,undergraduate and graduate admission to colmex is very selective
common_voice_en_18712136.wav,the area immediately south and west of st lambert was covered with german dead
common_voice_en_18712375.wav,hu is now a san francisco based venture capitalist with walden international investment group
common_voice_en_18717937.wav,the figure of kathleen ni houlihan has also been invoked in nationalist irish politics
common_voice_en_18738491.wav,she was born candice mcclure in durban south africa
common_voice_en_18738593.wav,she was cremated at streatham park cemetery
common_voice_en_18738686.wav,south cariboo regional airport is the regional facility for the south cariboo
common_voice_en_18750846.wav,he was appointed master of the horse
common_voice_en_18750902.wav,however he never assumed the title
common_voice_en_18756657.wav,witchcraft and non mainstream esoteric study were prohibited and targeted by the inquisition
common_voice_en_18756680.wav,he also represented the yugoslavian national basketball team internationally
common_voice_en_18756706.wav,during the pleistocene toxodon was the largest common notoungulate
common_voice_en_18756738.wav,albert went on to join x pac and justin credible in their own stable x factor
common_voice_en_492213.wav,christian groups protest exxxotica
common_voice_en_18801912.wav,hillesheim's outlying stadtteile are niederbettingen and bolsdorf
common_voice_en_18779905.wav,he is the brother of dan troy and tevi david troy
common_voice_en_18779981.wav,neon lights of many colors glow from behind the framed painted mosaics
common_voice_en_18780013.wav,note: repealed titles have been omitted
common_voice_en_18780164.wav,spectacular launches were a feature of later test flights
common_voice_en_18782079.wav,the highest mountain is didi abuli at an elevation of above sea level
common_voice_en_18782106.wav,greyhound was then retired
common_voice_en_18867749.wav,ak sar ben is nebraska spelled backwards
common_voice_en_18867815.wav,radical scavengers proved a viable method of measuring production of hydroxyl radical
common_voice_en_18883253.wav,paranormal researcher john zaffis told hawes that he was becoming sensitive to paranormal phenomena
common_voice_en_18350792.wav,your services are appreciated
common_voice_en_18586876.wav,no my lady i've seen him!
common_voice_en_18594344.wav,you are hot in here!
common_voice_en_18586900.wav,‘we’d better take it with us’ the knight said
common_voice_en_18600108.wav,it was a thing to look at
common_voice_en_18605170.wav,i now froze and the face became hard and set
common_voice_en_18637100.wav,only if you are fine and big enough to consent
common_voice_en_18641761.wav,by jove bertie i don't know how to thank you
common_voice_en_18735362.wav,the base of the building is clad in rosa purino carnelian granite
common_voice_en_18748233.wav,the kars tbilisi baku railway will run along the line through the city
common_voice_en_18854324.wav,she has a pet rock rocco much to elmo's constant dismay
common_voice_en_18854403.wav,hell no we ain't all right!
common_voice_en_18854508.wav, the first application was given to a pune police station
common_voice_en_18868626.wav,the campus is located in the area of pance south of the city
common_voice_en_594203.wav,a light brown puppy wearing a muzzle stands upright against a woman with red nails
common_voice_en_594210.wav,two senior women talk while sitting on a bench
common_voice_en_594242.wav,two people of asian descent sit at a table drinking and smoking cigarettes
common_voice_en_594233.wav,a man in a blue shirt runs under a blue road marker in a race
common_voice_en_594253.wav,a small girl is holding a wiffle ball bat outdoors
common_voice_en_594259.wav,three musical performers do their act
common_voice_en_594276.wav,a fisherman with his friend is setting up his pole
common_voice_en_594274.wav,two children play outside in the yard
common_voice_en_594270.wav,a biker in red rides in the countryside
common_voice_en_594297.wav,a race car driver celebrates with a bottle of champagne
common_voice_en_594303.wav,man in white shirt descends a rock cliff
common_voice_en_594301.wav,the girl is playing along with the images on the big screen
common_voice_en_594306.wav,a child is laying down in a playground while another child observes
common_voice_en_594310.wav,the cowboy kneels down to put the brown strap on his boot
common_voice_en_594317.wav,a boy and a man cross a river on an elephant
common_voice_en_594329.wav,a man in a blue shirt and blue jeans standing behind a subway sign
common_voice_en_594350.wav,one boy pushes another on a swing
common_voice_en_594372.wav,a campsite with tents and picnic tables
common_voice_en_594370.wav,a little boy is playing with a yellow shovel in front of a christmas tree
common_voice_en_594379.wav,a woman carries a backpack and teal jacket
common_voice_en_594380.wav,a young couple play in a fountain
common_voice_en_594385.wav,two boys in uniforms exchanging an item
common_voice_en_594406.wav,two boys in uniform playing a game of field hockey with an adult blowing on a whistle
common_voice_en_594424.wav,a person in a green shirt holding a colorful umbrella
common_voice_en_594435.wav,a man wearing jeans and a gray shirt standing behind a spray painted brick wall
common_voice_en_594450.wav,a group of children are playing near a statue
common_voice_en_594471.wav,a woman points to the inside of a computer as a young girl looks on
common_voice_en_594480.wav,a couple enjoying the night lights together
common_voice_en_594484.wav,a couple of people are sitting on a big staircase
common_voice_en_594498.wav,four women pose for a photograph with a man in a bright yellow suit
common_voice_en_594500.wav,blond child is learning self deference
common_voice_en_594507.wav,three men playing drums bass and piano
common_voice_en_594513.wav,a bicycle repairman shows two men what was wrong with their bike
common_voice_en_594535.wav,three young boys playing outside and posing for a picture
common_voice_en_594542.wav,a woman is weaving something in green
common_voice_en_594554.wav,the dog runs through the water while holding a yellow ring
common_voice_en_594553.wav,two surfers preparing to enter the water for a competition
common_voice_en_594569.wav,a man is looking at a shrub
common_voice_en_594608.wav,two young boys in swim trunks wash a big brown dog
common_voice_en_594602.wav,a man is walking through the courtyard of an old building
common_voice_en_594641.wav,two children are having a sack race
common_voice_en_594662.wav,a person 's hands work on some sort of project
common_voice_en_594672.wav,woman wearing an orange scarf holding a cellphone
common_voice_en_594732.wav,a girl is eating cereal out of a white bowl
common_voice_en_594734.wav,a boy dribbles a soccer ball in a grass field next to a parking lot
common_voice_en_594773.wav,a woman in a yellow shirt eating
common_voice_en_594785.wav,there are two men on a stage with guitars greeting each other
common_voice_en_594778.wav,a young boy performs a backflip off a cliff into the sea
common_voice_en_594805.wav,a donkey is pulling the cart down the road
common_voice_en_594803.wav,a baby taking a bath in a tub
common_voice_en_594807.wav,violinist writing down music with a pencil
common_voice_en_594809.wav,one boy is trying to kiss another in a school lunch room
common_voice_en_594822.wav,a woman cooks a variety of meets on a grill while others stand in the background
common_voice_en_594854.wav,a loan motorcyclist riding a red motorcycle on a racetrack
common_voice_en_594850.wav,children play in the street under a spray of water from a large machine
common_voice_en_594861.wav,a child wearing a red shirt playing
common_voice_en_594863.wav,greyhounds take a corner at a race
common_voice_en_594873.wav,a man with a strange helmet is sitting on top of a blue motorcycle
common_voice_en_594893.wav,guy jumping off a pier into lake
common_voice_en_594877.wav,a young girl in glasses and sweatsuit swings a racket
common_voice_en_594907.wav,a woman delivery truck driver is reaching for a box
common_voice_en_594902.wav,three sisters in matching pink dresses standing on the beach
common_voice_en_594912.wav,a small dog runs to catch a ball
common_voice_en_594916.wav,a bartender making a tray of drinks in champagne flutes
common_voice_en_594921.wav,several people are walking around outside
common_voice_en_594934.wav,a motorcycle rider drives fast around a curve on a track
common_voice_en_594945.wav,a woman is walking past a sign
common_voice_en_594942.wav,a surfer attempts to stand on his board as water splashes up from the sides
common_voice_en_594950.wav,a snowboarder in a red jacket slides down a snowy mountain
common_voice_en_594961.wav,a historiclooking building
common_voice_en_594969.wav,a girl in denim shorts and a tshirt is outside cooking meat on a grill
common_voice_en_594973.wav,students attend a math lecture at university
common_voice_en_594966.wav,the lady is sitting down to a nice chicken dinner
common_voice_en_594985.wav,a man kisses the neck of a woman sitting on his lap
common_voice_en_594977.wav,several children are playing soccer in a field
common_voice_en_594990.wav,a group of people on a dock with a boat on the other side of the dock
common_voice_en_594978.wav,three men in white wait to swing at a ball
common_voice_en_595015.wav,a brown dog runs fast outside on green grass
common_voice_en_595027.wav,a girl is observing some carvings on a stone wall
common_voice_en_595012.wav,an asian couple posing for a picture in a restaurant
common_voice_en_595033.wav,a small black and white dog carrying a red bucket in his mouth
common_voice_en_595037.wav,white cat perched on a stone wall
common_voice_en_595036.wav,three people stand in an outdoor glass structure
common_voice_en_595040.wav,a boy is outside wearing a tshirt and shorts while he does a back flip
common_voice_en_595056.wav,a well dressed man with glasses working with an open piano
common_voice_en_595065.wav,two children are preparing to go on an elephant ride
common_voice_en_595060.wav,a man standing alone in a park
common_voice_en_595068.wav,a darkhaired boy carrying a large black trash bag over his shoulder
common_voice_en_595083.wav,a firefighter sprays water onto a gigantic pile or burning ash that includes flames and dark smoke
common_voice_en_595077.wav,xylophonists play in a dark setting
common_voice_en_595088.wav,a child swings a bat next to a stone wall
common_voice_en_595090.wav,a man and woman posing for a picture on a mountain hike
common_voice_en_18877720.wav,ousmane sy was born in bandiagara mali
common_voice_en_18673834.wav,this steam powered tramway was at the time the longest in the world
common_voice_en_18734812.wav,zchiw song ensemble aka
common_voice_en_18854374.wav,some hemolysins affects the sterols of the host cytoplasmic membrane
common_voice_en_18673688.wav,chałubiński established tuberculosis sanatoria in zakopane in the tatra mountains
common_voice_en_18852246.wav,corporate power can also increase income inequality
common_voice_en_18852251.wav,oenophiles are also known as wine aficionados or connoisseurs
common_voice_en_18915889.wav,other important cities include soledad and malambo
common_voice_en_18925166.wav,bandeiraea simplicifolia benth
common_voice_en_18931108.wav,seasonal climatic problems include spring sandstorms and winter zud
common_voice_en_18696828.wav,americanapparelnet is the company's e commerce sales hub
common_voice_en_18698449.wav,that year he also launched his website wwwthomashampsoncom
common_voice_en_18861875.wav,carl bildt has also been appointed as an advisor to russian controlled investment group letterone
common_voice_en_18862189.wav,together with his colleague elastinen he formed the finnish rap band fintelligens
common_voice_en_18865218.wav,major production centers around attica boeotia and euboea
common_voice_en_18865358.wav,greater noida is the district administrative headquarters
common_voice_en_18870674.wav,the convent also has interesting architecture in manueline and baroque styles
common_voice_en_18573080.wav,we use an agile work flow for delivering projects
common_voice_en_18699185.wav,some copies are sold as a phil lewis solo album
common_voice_en_18699985.wav,hollandexel operated an international scheduled service to curaçao
common_voice_en_18699998.wav,the main lifts are open in both summer and winter
common_voice_en_18739388.wav,the surface lies at above sea level
common_voice_en_18739525.wav,this portion was known as farm tin
common_voice_en_18778658.wav,an early variant name was saint paul
common_voice_en_18778670.wav,his two sons were also killed
common_voice_en_18778682.wav,such combs were introduced in the mid twentieth century
common_voice_en_18778700.wav,the family names evershaw and eversaw are derived from this place
common_voice_en_18782973.wav,marriage between members of different classes of the society was forbidden
common_voice_en_18782980.wav,again thank you all so much for the love and support you've given us
common_voice_en_18783233.wav,there are also swimming areas adjacent to the campground
common_voice_en_18783255.wav,for a short period as well he was the minister of social affairs
common_voice_en_18783267.wav,the first two from each group play the semifinals
common_voice_en_18783282.wav,for instance the circle and the line are very different objects
common_voice_en_18816256.wav,cincinnati creek flows through the village from north to south
common_voice_en_18816251.wav,reelin may also play a role in alzheimer's disease temporal lobe epilepsy and autism
common_voice_en_18816273.wav,trained as a metallurgist he became a successful leader and businessman
common_voice_en_18816280.wav,ibrahim finally reached the saudi capital at diriyah
common_voice_en_18816341.wav,a bonus is awarded if all the balloons are popped before the music ends
common_voice_en_18816348.wav,often only two strings were used as in certain regional silk and bamboo ensembles
common_voice_en_18816373.wav,closed bolt designs are often used in rifles
common_voice_en_18816391.wav,california allows fishing for mitten crabs with some restrictions
common_voice_en_18816392.wav,the yard offers boat storage berthing afloat repairs and complete refits
common_voice_en_18816418.wav,life after death and taxes is more of a closer to failure to excommunicate
common_voice_en_18816466.wav,characters can appear in more than one category
common_voice_en_18816460.wav,call it the first true movie of the digital revolution
common_voice_en_18835696.wav,warren breed's the self guiding society provides a critical overview of the active society
common_voice_en_18840344.wav,anthophyllite is polymorphic with cummingtonite
common_voice_en_18840400.wav,davis had several children while espousing limitations on childbearing worldwide
common_voice_en_18873210.wav,it has not been widely commercialized
common_voice_en_18873209.wav,an engine with six cylinders was also a world's first
common_voice_en_18873264.wav,belknap puts vince under hypnosis and tries to get him to drown himself
common_voice_en_18873290.wav,the arrangement lasted approximately two weeks
common_voice_en_18873292.wav,'ylow' is the old prussian term for 'mud' or 'swamp'
common_voice_en_18873294.wav,alejandro and his brother did not watch much television
common_voice_en_18873311.wav,it is also a major transfer point for commuters within urban gloucester
common_voice_en_18873315.wav,zara's products are supplied based on consumer trends
common_voice_en_18873326.wav,when are you lonesome tonight
common_voice_en_18873329.wav,frequent physical effects are nausea numbness of the tongue or throat and pupil dilation
common_voice_en_18873390.wav,mertens diplomatically describes his proof as more precise and rigorous
common_voice_en_18873319.wav,the hindwings are dark with an orange border
common_voice_en_18873404.wav,he started to trade up his women's wear and offer higher style garments
common_voice_en_18873442.wav,valley is an alabama community of excellence
common_voice_en_18873431.wav,it's close to an out of body experience
common_voice_en_18873455.wav,chinese outrage over this provision led to demonstrations known as the may fourth movement
common_voice_en_18873479.wav,it was also the only movie in which presley wore a beard
common_voice_en_18894717.wav,today armin prince of lippe is the owner of detmold castle
common_voice_en_18894795.wav,lakhani is the most well known of all ismaeli tycoons
common_voice_en_18894821.wav,the group is intended to promote co operation between the three countries in crisis zones
common_voice_en_18894844.wav,the tracker holds up in the town factory and snipes down the team
common_voice_en_18897874.wav,this codified for the first time the law relating to british nationality
common_voice_en_18897956.wav,his older brothers were joab and abishai
common_voice_en_18724383.wav,hiroyuki nakano
common_voice_en_18724471.wav,galactonolactone then reacts with the mitochondrial ﬂavoenzyme galactonolactone dehydrogenase
common_voice_en_18767214.wav,makibishi were one of the items supposedly used by ninja
common_voice_en_18703592.wav,a small creek called vinalopó flows through the city splitting it in two parts
common_voice_en_18751582.wav,the original anthem benderaku was written by malaysian songwriter tony fonseka
common_voice_en_18765633.wav,he is not elected by popular vote
common_voice_en_18792371.wav,the memorial also serves as a disincentive to hitler tourism
common_voice_en_18792361.wav,settlements include ruatahuna and ruatoki

