common_voice_en_18721013.wav,light with a short wavelength consists of photons of high energy
common_voice_en_18721012.wav,talks in antaragni usually center around the theme of the festival for that year
common_voice_en_587388.wav,because we're the people and we're tough!
common_voice_en_18709613.wav,the right panel depicts the pietà and the limbo of the just
common_voice_en_151437.wav,add metal overload to my playlist mihalis hatzigiannis
common_voice_en_18833935.wav,what kind of man would i be
common_voice_en_18833939.wav,a cooling system and mechanical ventilation system were installed
common_voice_en_121397.wav,a woman with four children are eating ice cream cones
common_voice_en_17723406.wav,count not your chickens before they are hatched
common_voice_en_476526.wav,can i see the cup winner at the closest movie house
common_voice_en_18642353.wav,that was not my intention
common_voice_en_18888259.wav,it was all a little bit twee
common_voice_en_699368.wav,a tan dog is jumping over a hurdle that is on fire on the ends
common_voice_en_18662913.wav,these entrants all have an entrepreneurial mindset
common_voice_en_18759664.wav,he scored it three out of five stars
common_voice_en_648407.wav,a man is getting a shave in a barber shop
common_voice_en_18869252.wav,in oral argument adv
common_voice_en_18597639.wav,he has never missed a day before
common_voice_en_17734248.wav,first the land based trade route between east and west lost relevance
common_voice_en_42604.wav,this is the mayor
common_voice_en_18928522.wav,there are houseboats with fully furnished single room double room and triple rooms
common_voice_en_18733197.wav,another frontrunner in this regard was m ali tim
common_voice_en_18900024.wav,drop kicks are also optional for a penalty kick to score a penalty goal
common_voice_en_18817562.wav,chapters built large box stores with a much larger product selection
common_voice_en_18817577.wav,the use of random assignment cannot eliminate this possibility but it greatly reduces it
common_voice_en_127637.wav,a man is standing on some rocks while waves lap around him
common_voice_en_158612.wav,chinese people walking down a street
common_voice_en_18848250.wav,the last time jatayu met meghraj was at golapi mukto rahashya
common_voice_en_18709177.wav,he worked as a programmer for honeywell
common_voice_en_574049.wav,i enjoyed it a lot because they are both lovely people
common_voice_en_18859612.wav,he studied musical composition at northwestern university
common_voice_en_18733608.wav,he is also known for his random acts of kindness
common_voice_en_18733300.wav,musically we were going to meet each other half way
common_voice_en_5808382.wav,the boss ran the show with a watchful eye
common_voice_en_218391.wav,book a restaurant reservation near oregon next week
common_voice_en_18733348.wav,he held the royal humane society medal for life saving
common_voice_en_694920.wav,a group of men in green shirts and black pants holding hands
common_voice_en_694911.wav,a baby washes its hands in soapy water from a sink
common_voice_en_18471578.wav,the manufacturers will charge more if we demand the change
common_voice_en_18733641.wav,the inn currently serves as the private residence of thomas kipps of capon bridge
common_voice_en_18708545.wav,the municipality comprises the villages of aartrijke loppem veldegem and zedelgem proper
common_voice_en_18461771.wav,shall we watch a film at the cinema this afternoon
common_voice_en_18743259.wav,martinez also was featured on kmaro's femme like you and crazy
common_voice_en_18733519.wav,this specification only applies to audio amplifiers
common_voice_en_18419280.wav,you couldn't blame me for withdrawing
common_voice_en_18546739.wav,he tells it as he does it in mere simplicity
common_voice_en_18733320.wav,numerous devices and tricks were used in the filming
common_voice_en_18476613.wav,once in the cockpit he was in his element
common_voice_en_62568.wav,marx and engels have analyzed and criticized capitalism
common_voice_en_18713168.wav,according to thomas rudd gaap is opposed by the shemhamphorasch angel ieuiah
common_voice_en_18723852.wav,anderson almost doubled the city's recycling capacity in one year
common_voice_en_18306401.wav,society is shaken to its foundations
common_voice_en_59751.wav,i guess you must think i'm kinda batty
common_voice_en_496376.wav,i will tell her what we decided
common_voice_en_17263741.wav,do you mean it
common_voice_en_17390325.wav,to increase his popularity in publicopinion polls the politician started a campaign
common_voice_en_216602.wav,rate the current book two stars
common_voice_en_125399.wav,thai dancers happily going through their steps in unison
common_voice_en_148006.wav,what kind of a proof is that
common_voice_en_580095.wav,her mom took her to the judo class at four o'clock
common_voice_en_18741815.wav,the final medal tally was led by host vietnam followed by thailand and indonesia
common_voice_en_649220.wav,i notice you still remember it
common_voice_en_17365657.wav,he kept driving at full speed totally unfazed by the flap flap flap of the burst tyre
common_voice_en_657912.wav,we've got to walk up to the tower
common_voice_en_17915682.wav,you might hear font families more than typefaces even though they could mean the same thing
common_voice_en_308727.wav,to err is human to forgive divine
common_voice_en_42504.wav,an huge hole had been made by the impact of the projectile
common_voice_en_484139.wav,a bird in hand is worth two in the bush
common_voice_en_534977.wav,i think they perceived that nothing was to be done at the moment
common_voice_en_567974.wav,i would have won the junior olympics if not for those medaling kids
common_voice_en_479944.wav,but instead of being saddened he was happy
common_voice_en_673134.wav,the sea has lived on in this shell because that's its destiny
common_voice_en_18607767.wav,in times of despair look out for the helpers and you will find hope
common_voice_en_651126.wav,a little token of appreciation
common_voice_en_509774.wav,you're just the one i wanted to see
common_voice_en_696182.wav,the boy wanted to believe that his friend had simply become separated from him by accident
common_voice_en_555316.wav,but not for long
common_voice_en_625749.wav,it seemed so safe and tranquil
common_voice_en_572266.wav,for at that time it had not occurred to him that it might be hollow
common_voice_en_540082.wav,that's the kind of stuff they want
common_voice_en_67966.wav,she crouched down to lace her shoes and spotted a four leaf clover
common_voice_en_200392.wav,i was scared but wasted no time in going out and crossing the bridge to the sand pits
common_voice_en_250.wav,it's hard to compare something necessary and mundane with something i'm excited about
common_voice_en_658583.wav,you'd better get your friends
common_voice_en_4495636.wav,nothing lost for lack of asking
common_voice_en_39175.wav,why did you want to see me the boy asked
common_voice_en_18343883.wav,but we'll just postpone this
common_voice_en_17818263.wav,their application for asylum has been accepted since they're victims of political persecution
common_voice_en_18828505.wav,five peaks overlooked on that list are indicated with an asterisk
common_voice_en_573656.wav,he decided to return to his friend's stable by the longest route possible
common_voice_en_129916.wav,a person is bowling in this blurry action shot
common_voice_en_18004367.wav,what does it all mean
common_voice_en_655167.wav,i'm addicted to recycling
common_voice_en_497292.wav,and so it was
common_voice_en_102654.wav,i'm going to tell your mother on you
common_voice_en_64022.wav,one dog wades in the water while another dog is on land
common_voice_en_113298.wav,a girl in a red shirt is rock climbing
common_voice_en_17245950.wav,jade's cordless drill has become faulty
common_voice_en_17489892.wav,there was an accident at work a camel stampede nearly killed the janitor
common_voice_en_503798.wav,how did you find out
common_voice_en_619458.wav,and he told what he had seen
common_voice_en_17623430.wav,where did charlotte leave her keys
common_voice_en_655595.wav,this is for you he said holding one of the parts out to the monk
common_voice_en_633986.wav,that night there was another jetting out of gas from the distant planet
common_voice_en_17290751.wav,well it seems that i am running out of cereals for breakfast
common_voice_en_219953.wav,the englishman didn't answer him directly
common_voice_en_18264295.wav,i left the car at the garage
common_voice_en_18822586.wav,stores include an aldi supermarket a smaller foodworks grocery store and a mcdonald's restaurant
common_voice_en_19609.wav,these are the spies said one of the men
common_voice_en_18032955.wav,if he had it on him then they'll have that too
common_voice_en_34404.wav,and he gave the boy his blessing
common_voice_en_18733679.wav,they currently hang in hartwall areena in helsinki
common_voice_en_17796224.wav,i do not know
common_voice_en_125799.wav,of course the two were unable to do anything
common_voice_en_447551.wav,the agent secretly entered the embassy from the roof
common_voice_en_555238.wav,then suddenly he noticed it with a start
common_voice_en_180575.wav,i thought about the difficulties in translation that might arise
common_voice_en_663007.wav,what had been next to him five minutes ago was now at the other side
common_voice_en_202455.wav,sometimes it's better to be with the sheep who don't say anything
common_voice_en_5478736.wav,i need to pay rent and keep the doors open
common_voice_en_17808129.wav,this part of the town was half residential half industrial
common_voice_en_89201.wav,children play badminton on the lawn
common_voice_en_137774.wav,hundreds must have seen it and taken it for a falling star
common_voice_en_103666.wav,it's the other foreigner the englishman
common_voice_en_17846037.wav,first impressions are the most lasting
common_voice_en_600130.wav,sometimes i appear in the form of a solution or a good idea
common_voice_en_686664.wav,the boy saw a man appear behind the counter
common_voice_en_696712.wav,a young arab also loaded down with baggage entered and greeted the englishman
common_voice_en_18707945.wav,they have two children erik and alexandra
common_voice_en_264703.wav,a shower of dirt fell from the hot pipes
common_voice_en_17667183.wav,the majority always claims to be pacifist but
common_voice_en_49360.wav,you point to a trail of ants leading into the house
common_voice_en_17431530.wav,i could be wrong but it's somewhere in that region
common_voice_en_3682148.wav,there were thirty girls on the soccer field
common_voice_en_208509.wav,the alchemist lighted the fire and soon a delicious aroma filled the tent
common_voice_en_540547.wav,to scare a bird is not the way to catch it
common_voice_en_18153331.wav,the egg's shell is hard and brittle while the interior is sticky on the fingers
common_voice_en_2381440.wav,greediness burst the bag
common_voice_en_17366552.wav,lgbt stands for lesbian gay bisexual and transgender
common_voice_en_541568.wav,will i learn to do that someday the boy asked
common_voice_en_597541.wav,there's a caravan leaving today for alfayoum
common_voice_en_17256264.wav,did you see the chap over there with his arms in the air like he just doesn't care
common_voice_en_17920131.wav,well you shouldn't have any trouble then
common_voice_en_17784341.wav,when alvin was a little boy he loved to watch bud spencer and terence hill
common_voice_en_580576.wav,what is it that i still need to know the boy asked
common_voice_en_10370.wav,he had used the two stones only once one morning when he was at a marketplace
common_voice_en_86465.wav,a woman carries a backpack and teal jacket
common_voice_en_501731.wav,it was however still so hot from its flight through the air
common_voice_en_202225.wav,i dare her to move that desk out of here
common_voice_en_78883.wav,this morning i found a calculator taped to my wii
common_voice_en_54384.wav,undefined
common_voice_en_17832183.wav,as you sow so shall you reap
common_voice_en_19226.wav,the google search bar is for searching not for typing urls!
common_voice_en_18539477.wav,i have done with the red coat believe me
common_voice_en_503476.wav,but i didn’t think that it contained any living creature
common_voice_en_57546.wav,scattered groups of people were hurrying from the direction of woking
common_voice_en_18353802.wav,refer to the owner's manual for further instructions
common_voice_en_17643646.wav,she's gonna like it isn't she
common_voice_en_158552.wav,why does the ice cream truck keep playing such a sad song “send in the clowns”
common_voice_en_113254.wav,he had assumed he would soon return to his sheep
common_voice_en_190149.wav,we've done it! said the englishman who had also awakened early
common_voice_en_510932.wav,a man in a blue shirt and jeans poses by large mossy rocks
common_voice_en_17262153.wav,are you ready to hear my counterargument
common_voice_en_191353.wav,amen
common_voice_en_17645060.wav,did you know that
common_voice_en_574227.wav,am i going to find my treasure he asked
common_voice_en_17293.wav,a rock climber clings to a steep overhanging rock high above a mesa
common_voice_en_86581.wav,i have watched the caravan as it crossed the desert he said
common_voice_en_675386.wav,i have come to enquire about the antelope
common_voice_en_196235.wav,a woman reading in the park with her shoes off
common_voice_en_125325.wav,elizabeth reclined gracefully
common_voice_en_17957625.wav,pink foam floated gently through the air landing on the parked vehicles
common_voice_en_549191.wav,they forgot that lead copper and iron have their own destinies to fulfill
common_voice_en_17820439.wav,a new broom sweeps clean what's bred in the bone
common_voice_en_657878.wav,young man in white tank top shirt long blue shorts playing tennis
common_voice_en_46012.wav,i'm going out and find them!
common_voice_en_171010.wav,she would never know the difference because she didn't know how to read
common_voice_en_11713842.wav,out of sight out of mind
common_voice_en_18474.wav,they're not worth much the englishman answered
common_voice_en_588556.wav,on the seventh day the alchemist decided to make camp earlier than usual
common_voice_en_629930.wav,they're not for sale he said
common_voice_en_507964.wav,on the islands the sea breeze is soft and mild
common_voice_en_311874.wav,we need to ski down the hill before the sun sets
common_voice_en_18730705.wav,it is part of the hosford abernethy neighborhood association
common_voice_en_480331.wav,at once he connected the two incidents
common_voice_en_602377.wav,draw the chart with heavy black lines
common_voice_en_503469.wav,the wind began to blow again
common_voice_en_17754097.wav,the room was crowded with a wild mob
common_voice_en_624661.wav,he had seen the shooting star and was persuaded that a meteorite lay somewhere nearby
common_voice_en_18839133.wav,dame helena resigned shortly afterwards and was replaced by lord burns
common_voice_en_66713.wav,they're going to believe that one
common_voice_en_178527.wav,i've got to get katie out of jail!
common_voice_en_640241.wav,modifying the assets would be a copyright violation
common_voice_en_209908.wav,you shouldn't be here the alchemist answered
common_voice_en_17386335.wav,why are you doing this
common_voice_en_512587.wav,most meteorites are more or less rounded
common_voice_en_345829.wav,it's an ill wind that blows no one some good
common_voice_en_1763.wav,it was difficult not to think about what he had left behind
common_voice_en_345828.wav,he who sings drives away sorrow
common_voice_en_613002.wav,viral marketing is a buzzword used frequently by economists
common_voice_en_117858.wav,the emerald tablet is a direct passage to the soul of the world
common_voice_en_492505.wav,a man surrounded by staging is working
common_voice_en_546554.wav,the englishman said nothing
common_voice_en_17686109.wav,zora can you teach me how to yodel
common_voice_en_512670.wav,came to the bar he had entered on his first day there
common_voice_en_18095211.wav,peace came years after the war
common_voice_en_524164.wav,a fence cuts through the corner lot
common_voice_en_656409.wav,there was a rough patch of skin
common_voice_en_18409088.wav,i guess i'll have to share my food with you now
common_voice_en_55357.wav,many of whom are homeless and hungry
common_voice_en_17281451.wav,grow angry slowly there's plenty of time
common_voice_en_166414.wav,the caravans had been stopped at giza for some time waiting for the wars to end
common_voice_en_17253022.wav,she set it on the shelf and there it stayed
common_voice_en_17283106.wav,that's a really great idea!
common_voice_en_533212.wav,kate frank's a baker!
common_voice_en_10393.wav,a man and a girl stand in front of a large crowd
common_voice_en_398219.wav,carbon monoxide is a very dangerous gas
common_voice_en_17278193.wav,a drowning man will clutch at a straw
common_voice_en_508420.wav,but arms cannot be drawn unless they also go into battle
common_voice_en_270658.wav,two physicists pondered their revised quantum field theory together
common_voice_en_373477.wav,light maple makes for a swell room
common_voice_en_11675.wav,he didn't want to cry with the other people there
common_voice_en_509993.wav,cod is the main business of the north shore
common_voice_en_149967.wav,the top had certainly ceased to rotate
common_voice_en_503780.wav,until one of them dies i couldn't possibly meet anyone else
common_voice_en_545045.wav,everyone has once heard of the chicken egg problem
common_voice_en_18758587.wav,utilitarianism was revised and expanded by bentham's student john stuart mill
common_voice_en_16630345.wav,common voice
common_voice_en_17249848.wav,this beer has been brewed in germany more specifically in bavaria
common_voice_en_175041.wav,i'm going with you the boy said
common_voice_en_17908832.wav,who would have thought that
common_voice_en_458608.wav,i can't clone this git repository
common_voice_en_17519336.wav,well there's a big difference in sound
common_voice_en_17272351.wav,the tram will arrive in five minutes unless this timetable is wrong
common_voice_en_34400.wav,i'll be back in a minute
common_voice_en_17297407.wav,i was told by my instructor to use a nichrome wire to burn metal solids
common_voice_en_628552.wav,i should say not!
common_voice_en_18651467.wav,my assignment has been completed and submitted
common_voice_en_18651465.wav,the cheque has been rejected
common_voice_en_86702.wav,looking down at the spoon he held the boy saw that the oil was gone
common_voice_en_675201.wav,two people on red motorcycle riding with a group of motorcyclist
common_voice_en_675200.wav,a black and white dog jumping high to catch a ball
common_voice_en_18710312.wav,dealers of card or dice games often displayed these full body tattoos shirtless while playing
common_voice_en_131823.wav,leave no stone unturned
common_voice_en_39677.wav,he don't seem like a guy that'd fall into line
common_voice_en_553218.wav,i have also experimented with a fancier solution to this problem
common_voice_en_656007.wav,both of these support the extensions you'll need so it is really a matter of personal preference
common_voice_en_656009.wav,that bold remark will be remembered for a long time
common_voice_en_165361.wav,you can't put an old head on young shoulders
common_voice_en_554705.wav,i don't know how to find life in the desert the boy said
common_voice_en_104930.wav,isn't it a little crowded
common_voice_en_18558743.wav,and do you live alone here with these babies charley
common_voice_en_569650.wav,all roads go to jericho
common_voice_en_570501.wav,it's like the camel driver said: 'eat when it's time to eat
common_voice_en_18339761.wav,i'll be out of my head in fifteen minutes
common_voice_en_18339754.wav,sheldon glanced at the thermometer
common_voice_en_645169.wav,don't ask me how i know
common_voice_en_168906.wav,that's the reason why i came in fourth
common_voice_en_667090.wav,a child in a red shirt is sitting on his father 's shoulders
common_voice_en_18352995.wav,that is why i am am rattled he laughed
common_voice_en_541612.wav,oaks may fall when reeds take the storm
common_voice_en_16048370.wav,these pills do less good than others
common_voice_en_592406.wav,she spent almost all night finishing her thesis
common_voice_en_592407.wav,why don't you fellows get your own news
common_voice_en_18732129.wav,it is primarily known for its lake and motor racing
common_voice_en_18732130.wav,it continues to serve the community from this location
common_voice_en_180063.wav,they went in to drink the tea which was served in beautiful crystal glasses
common_voice_en_18004634.wav,build castles in the air
common_voice_en_87016.wav,epilepsy is a condition which sends the sufferer into uncontrollable convulsions
common_voice_en_496394.wav,this woman is sitting in a lawnchair on the sand
common_voice_en_18442052.wav,sooner or later three brothers three castles
common_voice_en_18316463.wav,bill lingered contemplating his work with artistic appreciation
common_voice_en_18009690.wav,i could go on for days about the delicious wines produced in this part of the world
common_voice_en_17264552.wav,after an avalanche buried the skiing resort it was hard to determine its exact location
common_voice_en_17245886.wav,the incubation period is typically about two weeks
common_voice_en_18652718.wav,a dreary name said the lord chancellor
common_voice_en_134200.wav,the people with programs are seated in a very large elegant room
common_voice_en_516196.wav,thought there might be one left over
common_voice_en_108557.wav,a man in a blue sweater sat at the desk
common_voice_en_17282642.wav,you could go for a brisk walk up constitution hill or something
common_voice_en_1511082.wav,both elephants and monkeys have a capable memory
common_voice_en_18481859.wav,little girls love pink fairy cakes
common_voice_en_680693.wav,find me the saga air cavalry
common_voice_en_17384570.wav,why didn't you object when you could
common_voice_en_378347.wav,hello! it is great to see you!
common_voice_en_620116.wav,the boy's name was santiago
common_voice_en_66773.wav,i feel quite ambivalent about the article
common_voice_en_569483.wav,how can you say that
common_voice_en_568305.wav,what good is money to you if you're going to die
common_voice_en_17468924.wav,the sandwich comes with ham cheese tomatoes mayonnaise pickles
common_voice_en_18556662.wav,celia raised her head to answer
common_voice_en_18684981.wav,peterson grew up in milton iowa and attended college at the university of tampa
common_voice_en_217226.wav,i sold crystal and crossed the desert
common_voice_en_17576858.wav,memes are very hackneyed she wrote in her book
common_voice_en_17772044.wav,it's late in the evening a perfect time for coffee
common_voice_en_17331569.wav,what's up homies you ready to go
common_voice_en_85217.wav,she was reminded of her mistakes
common_voice_en_15743191.wav,look! there is manuel crossing the street
common_voice_en_18886078.wav,some of his sculptures were directly inspired by russian dancers
common_voice_en_680731.wav,everything'll be taken care of!
common_voice_en_507146.wav,three men on horseback rope a calf at a rodeo
common_voice_en_690937.wav,the whole thing seemed depressingly futile
common_voice_en_690938.wav,show a clean pair of heels
common_voice_en_18408863.wav,are you going for a stroll
common_voice_en_659357.wav,a basketball player wearing blue and red is shooting a basket while onlookers sit outside the court
common_voice_en_659358.wav,young hooded boy and girl huddle on steps outside large doors
common_voice_en_17801249.wav,who was using this lab when the necklace was still here
common_voice_en_619816.wav,a dog with a stick in his mouth walking through water
common_voice_en_533825.wav,a young boy and young girl playing jenga on a wood floor
common_voice_en_18881799.wav,the following year they were married
common_voice_en_18891852.wav,however their adventures usually get them into quite a bit of trouble
common_voice_en_521962.wav,there was nothing else to do
common_voice_en_521963.wav,people should spend time on improving open source projects instead of helping market dominating companies
common_voice_en_483488.wav,you old sorcerer the boy shouted up to the sky
common_voice_en_18058301.wav,we usually parked our motorcycles near to this building
common_voice_en_17927407.wav,deferred is not denied
common_voice_en_16048258.wav,rick was in the first aid club as a sixth former
common_voice_en_601282.wav,guards are patrolling around the perimeter of the base
common_voice_en_182346.wav,the criminal courts building
common_voice_en_180752.wav,you won't have any trouble reading it
common_voice_en_16048328.wav,these days a chicken leg is a rare dish
common_voice_en_18756652.wav,lownes acted as executive producer
common_voice_en_17274033.wav,i just worked the tills for a couple of months then got too bored and left
common_voice_en_18758341.wav,also papuan languages of new guinea and nilo saharan languages of east africa are pro drop
common_voice_en_18565941.wav,a string across a cupboard!
common_voice_en_18852834.wav,crompton was replaced by derrick gyles
common_voice_en_478337.wav,why don't you shut up!
common_voice_en_18422052.wav,oh that yes
common_voice_en_580106.wav,mom took grandma to the garden center to hear the latin names of plants
common_voice_en_18831618.wav,arawn in switching bodies also exposes how virtuous pwyll is
common_voice_en_578386.wav,stop calling me that!
common_voice_en_18887309.wav,the town has been the site of two episodes of breaking bad
common_voice_en_599429.wav,many of our soldiers teamed up
common_voice_en_18534895.wav,what is social intelligence
common_voice_en_43664.wav,check movie schedules and find which animated movies are being aired in the neighborhood
common_voice_en_18474112.wav,please do not mess up with the buttons on this machine
common_voice_en_18738770.wav,there are also versions with a single handle
